<?xml version = "1.0" encoding ="utf-8" ?>
<!-- sheet.dtd  -->
<!ELEMENT sheet (row+) >
<!ELEMENT row (data+) >
<!ELEMENT data (#PCDATA)>
<!ATTLIST sheet name CDATA #REQUIRED >